0	_NEWLINE_ _NEWLINE_ _NEWLINE_ 199 F.3d 1295 _NEWLINE_ United States Court of Appeals , _NEWLINE_ Federal Circuit . _NEWLINE_ THE TORO COMPANY , Plaintiff-Appellee , _NEWLINE_ v. _NEWLINE_ WHITE CONSOLIDATED INDUSTRIES , INC. , and WCI Outdoor Products , Inc. , Defendants-Appellants . _NEWLINE_ No . 98-1334 . _NEWLINE_ | _NEWLINE_ Dec. 10 , 1999 . _NEWLINE_ Synopsis _NEWLINE_ Patentee brought action against competitor alleging infringement of patent for hand-held convertible vacuum/blower . The United States District Court for the District of Minnesota , David S. Doty , J. , granted summary judgment finding infringement , and competitor appealed . The Court of Appeals , Pauline Newman , Circuit Judge , held that : ( 1 ) phrase `` attachment means for removably securing said inlet air cover to said housing '' did not require that cover be entirely separated from housing , and ( 2 ) phrase `` cover including means for increasing the pressure '' required device 's restriction ring to be permanently affixed to and included as part of the cover . _NEWLINE_ _NEWLINE_ Reversed and remanded . _NEWLINE_ _NEWLINE_ Rader , Circuit Judge , filed dissenting opinion . _NEWLINE_ _NEWLINE_
1	_NEWLINE_ _NEWLINE_ _NEWLINE_ 231 F.3d 1339 _NEWLINE_ United States Court of Appeals , _NEWLINE_ Federal Circuit . _NEWLINE_ YAMANOUCHI PHARMACEUTICAL CO. , LTD. , Plaintiff-Appellee , _NEWLINE_ and _NEWLINE_ Merck & Co. , Inc. , Plaintiff-Appellee , _NEWLINE_ v. _NEWLINE_ DANBURY PHARMACAL , INC. , Schein Pharmaceutical , Inc. , and Marsam Pharmaceuticals , Inc. , Defendants-Appellants . _NEWLINE_ No . 99-1521 . _NEWLINE_ | _NEWLINE_ Decided Nov. 3 , 2000 _NEWLINE_ | _NEWLINE_ Rehearing and Rehearing En Banc Denied Dec. 14 , 2000 . _NEWLINE_ Synopsis _NEWLINE_ Owner of patent for anti-ulcer drug famotidine brought infringement action against competitor , who had filed Abbreviated New Drug Application ( ANDA ) for generic version . The United States District Court for the Southern District of New York , Richard Owen , Senior Judge , 21 F.Supp.2d 366 , held for owner and awarded attorney fees . On appeal , the Court of Appeals , Rader , Circuit Judge , held that : ( 1 ) patent was not invalid as obvious , and ( 2 ) filing of baseless ANDA warranted award of attorney fees . _NEWLINE_ _NEWLINE_ Affirmed . _NEWLINE_ _NEWLINE_
0	_NEWLINE_ _NEWLINE_ _NEWLINE_ 73 F.3d 1085 _NEWLINE_ United States Court of Appeals , _NEWLINE_ Federal Circuit . _NEWLINE_ PARA-ORDNANCE MANUFACTURING , INC. , Plaintiff-Appellant , _NEWLINE_ v. _NEWLINE_ SGS IMPORTERS INTERNATIONAL , INC. , Defendant/Cross-Appellant . _NEWLINE_ Nos . 94-1486 , 94-1487 . _NEWLINE_ | _NEWLINE_ Dec. 28 , 1995 . _NEWLINE_ | _NEWLINE_ Rehearing Denied ; Suggestion for Rehearing In Banc Declined March 20 , 1996 . _NEWLINE_ Synopsis _NEWLINE_ Holder of patent for conversion kit for expanding ammunition capacity of semiautomatic handguns sued alleged infringer . The United States District Court for the Eastern District of Virginia , Thomas Selby Ellis , III , J. , ruled that patent was invalid , and patent holder appealed . The Court of Appeals , Schall , Circuit Judge , held that use of one-piece frame with converging areas at top of grip in claimed conversion kit was obvious . _NEWLINE_ _NEWLINE_ Affirmed . _NEWLINE_ _NEWLINE_ Archer , Chief Judge , dissented and filed opinion . _NEWLINE_ _NEWLINE_
1	_NEWLINE_ _NEWLINE_ _NEWLINE_ 471 F.3d 1363 _NEWLINE_ United States Court of Appeals , _NEWLINE_ Federal Circuit . _NEWLINE_ ABBOTT LABORATORIES and Central Glass Company , Ltd. , Plaintiffs-Appellants , _NEWLINE_ v. _NEWLINE_ BAXTER PHARMACEUTICAL PRODUCTS , INC. and Baxter Healthcare Corp. , Defendants-Cross Appellants . _NEWLINE_ Nos . 06-1021 , 06-1022 , 06-1034 . _NEWLINE_ | _NEWLINE_ Nov. 9 , 2006 . _NEWLINE_ | _NEWLINE_ Rehearing and Rehearing En Banc Denied Jan. 16 , 2007 . _NEWLINE_ Synopsis _NEWLINE_ Background : Patentee brought action against competitor , alleging infringement of its patent for an anesthetic sevoflurane composition . The United States District Court for the Northern District of Illinois , 2002 WL 449007 , Ronald A. Guzman , J. , granted summary judgment for competitor , and patentee appealed . The Court of Appeals , 334 F.3d 1274 , vacated and remanded . On remand , the District Court , Guzman , J. , 2005 WL 2347221 , ruled that the patent was valid but not infringed , and patentee appealed . _NEWLINE_ _NEWLINE_ The Court of Appeals , Gajarsa , Circuit Judge , held that patent was anticipated by prior art patent . _NEWLINE_ _NEWLINE_ Reversed . _NEWLINE_ _NEWLINE_
1	_NEWLINE_ _NEWLINE_ _NEWLINE_ 867 F.3d 1229 _NEWLINE_ United States Court of Appeals , _NEWLINE_ Federal Circuit . _NEWLINE_ GEORGETOWN RAIL EQUIPMENT COMPANY , Plaintiff-Appellee _NEWLINE_ v. _NEWLINE_ HOLLAND L.P. , Defendant-Appellant _NEWLINE_ 2016-2297 _NEWLINE_ | _NEWLINE_ Decided : August 1 , 2017 _NEWLINE_ Synopsis _NEWLINE_ Background : Owner of patent related to a system and method for inspecting railroad tracks with the use of digital technology brought infringement action . Following claim construction , 2014 WL 11498109 , and jury trial , the United States District Court for the Eastern District of Texas , No . 6:13-cv-00366-RWS , Robert Schroeder III , J. , entered finding of infringement , and 2016 WL 3346084 , denied competitor 's renewed motion for judgment as a matter of law ( JMOL ) of noninfringement and awarded enhanced damages based on finding of willful infringement . Competitor appealed . _NEWLINE_ _NEWLINE_ Holdings : The Court of Appeals , Wallach , Circuit Judge , held that : _NEWLINE_ _NEWLINE_ competitor infringed patent ; _NEWLINE_ _NEWLINE_ substantial evidence supported award of lost profits ; _NEWLINE_ _NEWLINE_ substantial evidence supported finding that subjective recklessness led to willful infringement of patent ; and _NEWLINE_ _NEWLINE_ it was within district court 's discretion to award enhanced damages . _NEWLINE_ _NEWLINE_ Affirmed . _NEWLINE_ _NEWLINE_ *1233 Appeal from the United States District Court for the Eastern District of Texas in No . 6:13-cv-00366-RWS , Judge Robert Schroeder III . _NEWLINE_
0	_NEWLINE_ _NEWLINE_ _NEWLINE_ 602 F.3d 1325 _NEWLINE_ United States Court of Appeals , _NEWLINE_ Federal Circuit . _NEWLINE_ VERIZON SERVICES CORP. , Verizon Communications , Inc. , MCI Communications Corp. , and Verizon Business Global LLC , Plaintiffs-Appellants , _NEWLINE_ v. _NEWLINE_ COX FIBERNET VIRGINIA , INC. , Cox Virginia Telecom , Inc. , Cox Communications Hampton Roads , LLC , Coxcom , Inc. , and Cox Communications , Inc. , Defendants-Cross Appellants . _NEWLINE_ Nos . 2009-1086 , 2009-1098 . _NEWLINE_ | _NEWLINE_ April 16 , 2010 . _NEWLINE_ Synopsis _NEWLINE_ Background : Patentee brought action for infringement of patents for technology related to sending telephone calls in data packets through a network . Following jury trial , the United States District Court for the Eastern District of Virginia , Claude M. Hilton , Senior District Judge , entered judgment finding some the claims and valid and some of the claims not infringed , and both parties appealed . _NEWLINE_ _NEWLINE_ Holdings : The Court of Appeals , Linn , Circuit Judge , held that : _NEWLINE_ _NEWLINE_ alleged infringer 's arguments to the jury about claim scope did not subvert jury 's ability to fairly decide the issues before it ; _NEWLINE_ _NEWLINE_ lack of instruction on incorporation by reference was harmless ; _NEWLINE_ _NEWLINE_ article on Internet telephony was enabling , as required for it to anticipate patents ; _NEWLINE_ _NEWLINE_ Internet and network protocols was a relevant field of art in determining whether patents were invalid as obvious ; _NEWLINE_ _NEWLINE_ expert testimony supported jury 's determination that patents were invalid as anticipated ; and _NEWLINE_ _NEWLINE_ evidence supported jury 's determination that patents were not infringed , regardless of whether district court misconstrued patent claim . _NEWLINE_ _NEWLINE_ Affirmed . _NEWLINE_ _NEWLINE_
1	_NEWLINE_ _NEWLINE_ _NEWLINE_ 882 F.3d 1121 _NEWLINE_ United States Court of Appeals , Federal Circuit . _NEWLINE_ AATRIX SOFTWARE , INC. , Plaintiff-Appellant _NEWLINE_ v. _NEWLINE_ GREEN SHADES SOFTWARE , INC. , Defendant-Appellee _NEWLINE_ 2017-1452 _NEWLINE_ | _NEWLINE_ Decided : February 14 , 2018 _NEWLINE_ Synopsis _NEWLINE_ Background : Owner of patents directed to systems and methods for designing , creating , and importing data into a viewable form on a computer brought infringement action . Competitor moved to dismiss for patent invalidity . The United States District Court for the Middle District of Florida , No . 3:15-cv-00164-HES-MCR , Harvey E. Schlesinger , Senior Judge , 2016 WL 1375141 , determined that claims were invalid , and 2016 WL 7206173 , denied patent owner 's motion for leave to amend . Patent owner appealed . _NEWLINE_ _NEWLINE_ Holdings : The Court of Appeals , Moore , Circuit Judge , held that : _NEWLINE_ _NEWLINE_ patent claim was not ineligible as directed to intangible embodiment , and _NEWLINE_ _NEWLINE_ district court 's denial of patent owner 's motion to amend complaint was abuse of discretion . _NEWLINE_ _NEWLINE_ Vacated in part , reversed in part , and remanded . _NEWLINE_ _NEWLINE_ Reyna , Circuit Judge , filed an opinion concurring in part and dissenting in part . _NEWLINE_ _NEWLINE_ Procedural Posture ( s ) : On Appeal ; Motion to Dismiss for Failure to State a Claim ; Motion to Amend the Complaint . _NEWLINE_ *1123 Appeal from the United States District Court for the Middle District of Florida in No . 3:15-cv-00164-HES-MCR , Senior Judge Harvey E. Schlesinger . _NEWLINE_
0	_NEWLINE_ _NEWLINE_ _NEWLINE_ 521 F.3d 1351 _NEWLINE_ United States Court of Appeals , _NEWLINE_ Federal Circuit . _NEWLINE_ O2 MICRO INTERNATIONAL LIMITED , Plaintiff-Appellee , _NEWLINE_ v. _NEWLINE_ BEYOND INNOVATION TECHNOLOGY CO. , LTD. , Defendant-Appellant , _NEWLINE_ and _NEWLINE_ FSP Group and SPI Electronic Co. , Ltd. , Defendants-Appellants , _NEWLINE_ and _NEWLINE_ Lien Chang Electronic Enterprise Co. , Ltd. , Defendant-Appellant . _NEWLINE_ Nos . 2007-1302 , 2007-1303 , 2007-1304 . _NEWLINE_ | _NEWLINE_ April 3 , 2008 . _NEWLINE_ | _NEWLINE_ Rehearing and Rehearing En Banc Denied June 11 , 2008 . _NEWLINE_ Synopsis _NEWLINE_ Background : Owner of patents relating to inverter controllers , which convert low voltage direct current ( DC ) into higher voltage alternating current ( AC ) , brought infringement action against competitors . The United States District Court for the Eastern District of Texas , T. John Ward , J. , 2007 WL 869576 , inter alia granted patent owner a permanent injunction . Competitors appealed . _NEWLINE_ _NEWLINE_ Holdings : The Court of Appeals , Prost , Circuit Judge , held that : _NEWLINE_ _NEWLINE_ competitors did not waive on appeal any objection to claim construction determined at Markman hearing ; _NEWLINE_ _NEWLINE_ arguments regarding the meaning and legal significance of `` only if '' limitation were improperly submitted to the jury ; and _NEWLINE_ _NEWLINE_ prosecution history estoppel barred patent owner from relying on the doctrine of equivalents . _NEWLINE_ _NEWLINE_ Vacated and remanded . _NEWLINE_ _NEWLINE_
1	_NEWLINE_ _NEWLINE_ _NEWLINE_ 694 F.3d 1367 _NEWLINE_ United States Court of Appeals , _NEWLINE_ Federal Circuit . _NEWLINE_ 1ST MEDIA , LLC , Plaintiff-Appellant , _NEWLINE_ v. _NEWLINE_ ELECTRONIC ARTS , INC. , Harmonix Music Systems , Inc. , and Viacom , Inc. , Defendants-Appellees , _NEWLINE_ and _NEWLINE_ Sony Computer Entertainment America , INC. , Defendant-Appellee . _NEWLINE_ No . 2010-1435 . _NEWLINE_ | _NEWLINE_ Sept. 13 , 2012 . _NEWLINE_ | _NEWLINE_ Rehearing En Banc Denied Dec. 3 , 2012 . _NEWLINE_ Synopsis _NEWLINE_ Background : Assignee filed action against competitors alleging infringement of patent on entertainment system for use in purchasing and storing songs , videos , and multimedia karaoke information . Competitors asserted inequitable conduct defense and also counterclaimed for declaratory judgment of inequitable conduct . The United States District Court for the District of Nevada , James C. Mahan , J. , granted competitors ' requested declaratory judgment of inequitable conduct , held that patent was unenforceable , and dismissed action . Plaintiff appealed . _NEWLINE_ _NEWLINE_ Holdings : The Court of Appeals , Linn , Circuit Judge , held that : _NEWLINE_ _NEWLINE_ assignee 's motion to present its proofs first was not concession that competitors had met their threshold burden of showing intent to deceive ; _NEWLINE_ _NEWLINE_ district court clearly erred in relying on evidence showing , at best , that inventor and his lawyer knew that prior art was material , and inability of inventor and his lawyer to offer good faith explanation , as basis to infer deliberate decision to withhold prior art reference ; _NEWLINE_ _NEWLINE_ decision of district court to not credit testimony of inventor and his lawyer could not be used as affirmative evidence of selective disclosure ; and _NEWLINE_ _NEWLINE_ paying issue fee after prior art reference had been brought to their attention was not deliberate decision to withhold prior art reference . _NEWLINE_ _NEWLINE_ Reversed . _NEWLINE_ _NEWLINE_
1	_NEWLINE_ _NEWLINE_ _NEWLINE_ 789 F.2d 1556 _NEWLINE_ United States Court of Appeals , _NEWLINE_ Federal Circuit . _NEWLINE_ POLAROID CORPORATION , Plaintiff-Appellee , _NEWLINE_ v. _NEWLINE_ EASTMAN KODAK COMPANY , Defendant-Appellant . _NEWLINE_ Appeal No . 86-604 . _NEWLINE_ | _NEWLINE_ April 25 , 1986 . _NEWLINE_ Synopsis _NEWLINE_ Manufacturer of photographic products brought patent infringement action against competitor . The United States District Court for the District of Massachusetts , Rya W. Zobel , J. , entered judgment in favor of manufacturer , and competitor appealed . The Court of Appeals , Markey , Chief Judge , held that manufacturer 's patents on cameras , film units , and photographic processes were valid , and competitor infringed those patents . _NEWLINE_ _NEWLINE_ Affirmed . _NEWLINE_ _NEWLINE_
0	_NEWLINE_ _NEWLINE_ _NEWLINE_ 506 F.3d 1370 _NEWLINE_ United States Court of Appeals , _NEWLINE_ Federal Circuit . _NEWLINE_ ZENON ENVIRONMENTAL , INC. , Plaintiff-Cross Appellant , _NEWLINE_ v. _NEWLINE_ UNITED STATES FILTER CORPORATION ( now known as Water Applications & Systems Corporation ) , Defendant-Appellant . _NEWLINE_ Nos . 2006-1266 , 2006-1267 . _NEWLINE_ | _NEWLINE_ Nov. 7 , 2007 . _NEWLINE_ | _NEWLINE_ Rehearing En Banc Denied Feb. 12 , 2008 . * _NEWLINE_ Synopsis _NEWLINE_ Background : Patent owner brought action against competitor alleging infringement of patent for microfiltration of liquids in relatively large systems . The United States District Court for the Southern District of California , Rudi M. Brewster , Senior District Judge , granted judgment for owner . Competitor appealed . _NEWLINE_ _NEWLINE_ Holdings : The Court of Appeals , Lourie , Circuit Judge , held that : _NEWLINE_ _NEWLINE_ grandparent patent anticipated , and thereby invalidated , grandchild patent due to lack of continuity of disclosure in family chain , and _NEWLINE_ _NEWLINE_ question of whether intervening patents maintained continuity of disclosure by incorporating gas distribution system by reference that had been disclosed in grandparent patent , entitling grandchild patent to earlier filing date , was question of law subject to de novo review . _NEWLINE_ _NEWLINE_ Reversed . _NEWLINE_ _NEWLINE_ Newman , Circuit Judge , filed dissenting opinion . _NEWLINE_ _NEWLINE_
1	_NEWLINE_ _NEWLINE_ _NEWLINE_ 672 F.3d 1350 _NEWLINE_ United States Court of Appeals , _NEWLINE_ Federal Circuit . _NEWLINE_ MARINE POLYMER TECHNOLOGIES , INC. , Plaintiff-Appellee , _NEWLINE_ v. _NEWLINE_ HEMCON , INC. , Defendant-Appellant . _NEWLINE_ No . 2010-1548 . _NEWLINE_ | _NEWLINE_ March 15 , 2012 . _NEWLINE_ Synopsis _NEWLINE_ Background : Patentee sued competitor for allegedly infringing patent for polymer that promoted hemostasis , stopping bleeding or hemorrhage . The United States District Court for the District of New Hampshire , Joseph A. DiClerico , Jr. , J. , 2008 WL 1995454 , construed patent , subsequently granted patentee summary judgment of literal infringement , and after jury verdict in favor of patentee on invalidity defenses of anticipation and obviousness , 2010 WL 3070197 , granted patentee summary judgment on competitor 's inequitable conduct defense , then entered judgment awarding patentee $ 29,410,246 damages as reasonable royalties for past infringement and permanently enjoined future infringement , and 2010 WL 3120051 , denied competitor 's motion for judgment as matter of law . Competitor appealed . The Court of Appeals , Dyk , Circuit Judge , 659 F.3d 1084 , reversed judgment on infringement , vacated injunction and damages award , and remanded upon concluding that competitor had acquired intervening rights based on patentee 's actions during parallel reexamination proceeding . Subsequently , the Court of Appeals , 2012 WL 255331 , vacated appellate judgment and granted rehearing en banc . _NEWLINE_ _NEWLINE_ Holdings : The Court of Appeals , en banc , Lourie , Circuit Judge , held that : _NEWLINE_ _NEWLINE_ for an equally divided court , claim was correctly construed ; _NEWLINE_ _NEWLINE_ for an equally divided court , substantial evidence supported jury 's damages award ; _NEWLINE_ _NEWLINE_ intervening rights do not apply to claims that have not been amended and are not new ; and _NEWLINE_ _NEWLINE_ competitor did not acquire intervening rights to patent . _NEWLINE_ _NEWLINE_ Affirmed . _NEWLINE_ _NEWLINE_ Dyk , Circuit Judge , filed opinion dissenting in part , with whom Gajarsa , Reyna , and Wallach , Circuit Judges , joined in full , and Linn , Circuit Judge , joined in part . _NEWLINE_ _NEWLINE_
1	_NEWLINE_ _NEWLINE_ _NEWLINE_ 846 F.3d 1190 _NEWLINE_ United States Court of Appeals , Federal Circuit . _NEWLINE_ TINNUS ENTERPRISES , LLC , Zuru Ltd. , Plaintiffs-Appellees _NEWLINE_ v. _NEWLINE_ TELEBRANDS CORPORATION , Bed Bath & Beyond , Inc. , Defendants-Appellants _NEWLINE_ 2016-1410 _NEWLINE_ | _NEWLINE_ Decided : January 24 , 2017 _NEWLINE_ Synopsis _NEWLINE_ Background : Patentee brought action alleging competitor infringed its patent for a toy that filled multiple water balloons at once by channeling water into the balloons through a set of hollow tubes , connected to housing . The United States District Court for the Eastern District of Texas , Robert Schroeder , III , J. , 2015 WL 11089480 , adopted report and recommendation of John D. Love , United States Magistrate Judge , 2015 WL 11089479 , and entered preliminary injunction barring competitor from selling its product . Competitor appealed . _NEWLINE_ _NEWLINE_ Holdings : The Court of Appeals , Stoll , Circuit Judge , held that : _NEWLINE_ _NEWLINE_ application of plain and ordinary meaning to term `` attached '' in patent was reasonable when analyzing patentee 's likelihood of success on the merits ; _NEWLINE_ _NEWLINE_ it would review district court 's determination that competitor failed to raise a substantial question that patent was invalid for indefiniteness for plain error , rather than for abuse of discretion ; _NEWLINE_ _NEWLINE_ competitor failed to raise a substantial question of patent 's validity by arguing that patent claim term `` substantially filled '' was invalid for indefiniteness ; _NEWLINE_ _NEWLINE_ competitor did not show that patent was invalid as obvious ; and _NEWLINE_ _NEWLINE_ patentee demonstrated irreparable harm as a result of competitor 's allegedly infringing product . _NEWLINE_ _NEWLINE_ Affirmed . _NEWLINE_ _NEWLINE_ *1194 Appeal from the United States District Court for the Eastern District of Texas in No . 6:15-cv-00551-RWS-JDL , Judge Robert Schroeder , III . _NEWLINE_
0	_NEWLINE_ _NEWLINE_ _NEWLINE_ 401 F.3d 1313 _NEWLINE_ United States Court of Appeals , _NEWLINE_ Federal Circuit . _NEWLINE_ MEDRAD , INC. , Plaintiff-Appellant , _NEWLINE_ v. _NEWLINE_ MRI DEVICES CORPORATION , Defendant-Appellee . _NEWLINE_ No . 04-1134 . _NEWLINE_ | _NEWLINE_ March 16 , 2005 . _NEWLINE_ | _NEWLINE_ Rehearing Denied April 11 , 2005 . _NEWLINE_ Synopsis _NEWLINE_ Background : Owner of patent for overlapping radio frequency coils used in magnetic resonance imaging ( MRI ) sued competitor for infringement . The United States District Court for the Western District of Pennsylvania , Terrence F. McVerry , J. , determined that patent was invalid , and owner appealed . _NEWLINE_ _NEWLINE_ The Court of Appeals , Bryson , Circuit Judge , held that patent was invalid as anticipated . _NEWLINE_ _NEWLINE_ Affirmed . _NEWLINE_ _NEWLINE_
0	_NEWLINE_ _NEWLINE_ _NEWLINE_ 499 F.3d 1293 _NEWLINE_ United States Court of Appeals , _NEWLINE_ Federal Circuit . _NEWLINE_ AVENTIS PHARMA DEUTSCHLAND GmbH , Plaintiff-Cross Appellant , _NEWLINE_ and _NEWLINE_ King Pharmaceuticals , Inc. , Plaintiff-Cross Appellant , _NEWLINE_ v. _NEWLINE_ LUPIN , LTD. and Lupin Pharmaceuticals , Inc. , Defendants-Appellants . _NEWLINE_ Nos . 2006-1530 , 2006-1555 . _NEWLINE_ | _NEWLINE_ Sept. 11 , 2007 . _NEWLINE_ Synopsis _NEWLINE_ Background : Owner of patent brought action against competitor and its agent alleging infringement of patent on pharmaceutical drug that was used to treat high blood pressure . The United States District Court for the Eastern District of Virginia , Robert G. Doumar , Senior District Judge , 2006 WL 2008962 , granted judgment for owner . Defendants appealed . _NEWLINE_ _NEWLINE_ Holdings : The Court of Appeals , Linn , Circuit Judge , held that : _NEWLINE_ _NEWLINE_ scientist did not abandon , suppress , or conceal chemical composition , and thus composition had to be considered as part of prior art , and _NEWLINE_ _NEWLINE_ claims of patent for pharmaceutical drug ramipril , which covered 5 ( S ) stereoisomer of ramipril in composition substantially free of other isomers , were invalid over other composition of 5 ( S ) ramipril with its SSSSR stereoisomer . _NEWLINE_ _NEWLINE_ Reversed . _NEWLINE_ _NEWLINE_
1	_NEWLINE_ _NEWLINE_ _NEWLINE_ 991 F.2d 768 _NEWLINE_ United States Court of Appeals , _NEWLINE_ Federal Circuit . _NEWLINE_ INTERNATIONAL VISUAL CORPORATION , Plaintiff-Appellant , _NEWLINE_ v. _NEWLINE_ CROWN METAL MANUFACTURING CO. , INC. , Defendant-Appellee . _NEWLINE_ No . 92-1262 . _NEWLINE_ | _NEWLINE_ April 15 , 1993 . _NEWLINE_ Synopsis _NEWLINE_ Holder of patent on magnetically secured display apparatus sued competitor alleging infringement of patents . Competitor counterclaimed for declaratory judgment of noninfringement , invalidity , and unenforceability . On cross motions for summary judgment , the United States District Court for the Northern District of Illinois , James F. Holderman , Jr. , J. , granted summary judgment of noninfringement in favor of competitor . Patent holder appealed . The Court of Appeals held that : ( 1 ) district court 's determination of noninfringement of patent was based on erroneous interpretation of housing limitation as requiring that housing be separate and apart from permanent magnet means , and ( 2 ) remand was appropriate based upon court 's claim interpretation so that district court could decide issue of doctrine of equivalents . _NEWLINE_ _NEWLINE_ Reversed and remanded . _NEWLINE_ _NEWLINE_ Lourie , Circuit Judge , concurred and filed opinion . _NEWLINE_ _NEWLINE_
1	_NEWLINE_ _NEWLINE_ _NEWLINE_ 815 F.3d 1302 _NEWLINE_ United States Court of Appeals , _NEWLINE_ Federal Circuit . _NEWLINE_ ZOLTEK CORPORATION , Plaintiff-Appellant _NEWLINE_ v. _NEWLINE_ UNITED STATES , Defendant-Appellee . _NEWLINE_ No . 2014-5082 . _NEWLINE_ | _NEWLINE_ Feb. 19 , 2016 . _NEWLINE_ Synopsis _NEWLINE_ Background : Patentee brought action against United States , alleging that process used to produce carbon fiber sheet materials for military aircraft infringed patent for method of producing carbon fiber sheet products . Following three-day bench trial on issue of validity , the Court of Federal Claims , Edward J. Damich , Senior Judge , ruled that patent was invalid on grounds of obviousness and inadequate written description . Patentee appealed . _NEWLINE_ _NEWLINE_ Holdings : The Court of Appeals , Newman , Circuit Judge , held that : _NEWLINE_ _NEWLINE_ patent was not invalid for having inadequate written description , and _NEWLINE_ _NEWLINE_ patent was not invalid for obviousness . _NEWLINE_ _NEWLINE_ Reversed and remanded . _NEWLINE_ _NEWLINE_
