1	_NEWLINE_ _NEWLINE_ _NEWLINE_ 748 F.3d 1354 _NEWLINE_ United States Court of Appeals , _NEWLINE_ Federal Circuit . _NEWLINE_ SANOFI-AVENTIS DEUTSCHLAND GMBH and Aventis Pharma S.A. , Plaintiffs-Appellees , _NEWLINE_ and _NEWLINE_ Abbott GMBH & Co. KG , and Abbott Laboratories , Plaintiffs-Appellees , _NEWLINE_ v. _NEWLINE_ GLENMARK PHARMACEUTICALS INC. , USA ( now known as Glenmark Generics. , Inc. , USA ) and Glenmark Pharmaceuticals Ltd. , Defendants-Appellants . _NEWLINE_ No . 2012-1489 . _NEWLINE_ | _NEWLINE_ April 21 , 2014 . _NEWLINE_ | _NEWLINE_ Rehearing En Banc Denied July 9 , 2014 . _NEWLINE_ Synopsis _NEWLINE_ Background : Holder of patent for angiotensin-converting enzyme inhibitor ( ACE inhibitor ) and calcium antagonist drug brought action against competitor alleging patent infringement . Following jury verdict in favor of patent holder , competitor moved for judgment as a matter of law with regard to standing , lost profits , obviousness and obviousness type double patenting . Holder moved for permanent injunction . The United States District Court for the District of New Jersey , Dennis M. Cavanaugh , 821 F.Supp.2d 681 , granted patent holder 's motion and denied competitor 's motion . Competitor appealed . _NEWLINE_ _NEWLINE_ Holdings : The Court of Appeals , Newman , Circuit Judge , held that : _NEWLINE_ _NEWLINE_ district court 's judgment in patent infringement action was final and ripe for appeal ; _NEWLINE_ _NEWLINE_ substantial evidence supported finding that patent was not obvious ; _NEWLINE_ _NEWLINE_ it was within district court 's discretion to give jury instruction on destruction of evidence ; and _NEWLINE_ _NEWLINE_ owner of approved new drug application ( NDA ) for product and its distributor had standing to participate in patent infringement suit . _NEWLINE_ _NEWLINE_ Affirmed and remanded . _NEWLINE_ _NEWLINE_
1	_NEWLINE_ _NEWLINE_ _NEWLINE_ 618 F.3d 1354 _NEWLINE_ United States Court of Appeals , _NEWLINE_ Federal Circuit . _NEWLINE_ AMERICAN MEDICAL SYSTEMS , INC. and Laserscope , Plaintiffs-Appellants , _NEWLINE_ v. _NEWLINE_ BIOLITEC , INC. , Defendant-Appellee . _NEWLINE_ No . 2009-1323 . _NEWLINE_ | _NEWLINE_ Sept. 13 , 2010 . _NEWLINE_ | _NEWLINE_ Rehearing and Rehearing En Banc Denied Dec. 15 , 2010 . _NEWLINE_ Synopsis _NEWLINE_ Background : Patentee brought action against competitor , alleging infringement of patent for methods and devices for vaporizing tissue by using laser radiation . Following claim construction , 569 F.Supp.2d 313 , the United States District Court for the District of Massachusetts , Michael A. Ponsor , J. , 603 F.Supp.2d 251 , granted summary judgment for competitor . Patentee appealed . _NEWLINE_ _NEWLINE_ The Court of Appeals , Bryson , Circuit Judge , held that preamble phrase `` photoselective vaporization of tissue '' did not constitute limitation of patent claims , for various methods and devices for vaporizing tissue of enlarged prostate gland by using laser radiation . _NEWLINE_ _NEWLINE_ Reversed and remanded . _NEWLINE_ _NEWLINE_ Dyk , Circuit Judge , filed dissenting opinion . _NEWLINE_ _NEWLINE_
0	_NEWLINE_ _NEWLINE_ _NEWLINE_ 323 F.3d 1324 _NEWLINE_ United States Court of Appeals , _NEWLINE_ Federal Circuit . _NEWLINE_ ABBOTT LABORATORIES , Plaintiff-Appellant , _NEWLINE_ and _NEWLINE_ Fournier Industrie Et Sante and Laboratoires Fournier S.A. , Plaintiffs-Appellants , _NEWLINE_ v. _NEWLINE_ NOVOPHARM LIMITED , Defendant-Appellee . _NEWLINE_ No . 02-1387 . _NEWLINE_ | _NEWLINE_ DECIDED : March 20 , 2003 . _NEWLINE_ | _NEWLINE_ Rehearing Denied : April 30 , 2003 . _NEWLINE_ Synopsis _NEWLINE_ Assignee and licensee of patent for cholesterol drug brought infringement against manufacturer of generic version of drug . The United States District Court for the Northern District of Illinois , John W. Darrah , J. , 2002 WL 433584 , entered summary judgment in favor of defendant , and plaintiffs appealed . The Court of Appeals , Lourie , Circuit Judge , held that : ( 1 ) patent was not literally infringed , and ( 2 ) patent was not infringed under doctrine of equivalents . _NEWLINE_ _NEWLINE_ Affirmed . _NEWLINE_ _NEWLINE_
0	_NEWLINE_ _NEWLINE_ _NEWLINE_ 712 F.3d 549 _NEWLINE_ United States Court of Appeals , _NEWLINE_ Federal Circuit . _NEWLINE_ Bruce N. SAFFRAN , M.D. , Ph.D. , Plaintiff-Appellee , _NEWLINE_ v. _NEWLINE_ JOHNSON & JOHNSON and Cordis Corporation , Defendants-Appellants . _NEWLINE_ No . 2012-1043 . _NEWLINE_ | _NEWLINE_ April 4 , 2013 . _NEWLINE_ | _NEWLINE_ Rehearing En Banc Denied July 1 , 2013 . _NEWLINE_ Synopsis _NEWLINE_ Background : Patent owner filed action against competitor alleging infringement of patent on medical device directed toward treatment of damaged tissue . The United States District Court for the Eastern District of Texas , T. John Ward , J. , 740 F.Supp.2d 899 , construed claims , and , after jury verdict in patent owner 's favor , 2011 WL 1299607 , awarded damages , and , 2011 WL 1306420 , denied competitor 's motion for judgment as matter of law . Competitor appealed . _NEWLINE_ _NEWLINE_ Holdings : The Court of Appeals , Lourie , Circuit Judge , held that : _NEWLINE_ _NEWLINE_ term `` device '' meant a continuous sheet and excluded stents having open mesh holes ; _NEWLINE_ _NEWLINE_ function of `` means for release of at least one treating material in a directional manner '' was to release a drug preferentially toward the damaged tissue ; _NEWLINE_ _NEWLINE_ structure corresponding to function of releasing drug preferentially toward damaged tissue was hydrolyzable bonds ; and _NEWLINE_ _NEWLINE_ competitor 's medical stents , which both lacked a sheet covering the open mesh holes between their struts and lacked a drug affixed to their surfaces via hydrolyzable bonds , did not infringe upon patent . _NEWLINE_ _NEWLINE_ Reversed . _NEWLINE_ _NEWLINE_ Moore , Circuit Judge , filed opinion concurring in part . _NEWLINE_ _NEWLINE_ O'Malley , Circuit Judge , filed opinion concurring in part . _NEWLINE_ _NEWLINE_
1	_NEWLINE_ _NEWLINE_ _NEWLINE_ 295 F.3d 1292 _NEWLINE_ United States Court of Appeals , _NEWLINE_ Federal Circuit . _NEWLINE_ TRINTEC INDUSTRIES , INC. , Plaintiff-Appellant , _NEWLINE_ v. _NEWLINE_ TOP-U.S.A . CORPORATION , Defendant-Appellee . _NEWLINE_ No . 01-1568 . _NEWLINE_ | _NEWLINE_ July 2 , 2002 . _NEWLINE_ Synopsis _NEWLINE_ Patent assignee brought infringement action against competitor relating to patent directed toward cost effective method of producing , in low volume , multicolor faces for watches , clocks , thermometers , and other instruments . The United States District Court for the Southern District of Ohio , Joseph P. Kinneary , J. , concluded that patent was invalid as inherently anticipated . Assignee appealed . The Court of Appeals , Rader , Circuit Judge , held that : ( 1 ) patent was not invalid as inherently anticipated , and ( 2 ) term `` creating '' required substantive addition or modification of artwork in computer such as when graphics software added design to instrument face . _NEWLINE_ _NEWLINE_ Vacated and remanded . _NEWLINE_ _NEWLINE_
1	_NEWLINE_ _NEWLINE_ _NEWLINE_ 536 F.3d 1361 _NEWLINE_ United States Court of Appeals , _NEWLINE_ Federal Circuit . _NEWLINE_ In re OMEPRAZOLE PATENT LITIGATION _NEWLINE_ Astrazeneca AB , Aktiebolaget Hassle , KBI-E , Inc. , KBI , Inc. , and Astrazeneca LP , Plaintiffs-Appellees , _NEWLINE_ v. _NEWLINE_ Apotex Corp. , Apotex , Inc. , and Torpharm , Inc. , Defendants-Appellants , _NEWLINE_ and _NEWLINE_ Impax Laboratories , Inc. , Defendant-Appellant . _NEWLINE_ Nos . 2007-1414 , 2007-1416 , 2007-1458 , 2007-1459 . _NEWLINE_ | _NEWLINE_ Aug. 20 , 2008 . _NEWLINE_ | _NEWLINE_ Rehearing and Rehearing En Banc Denied Oct. 9 , 2008 . _NEWLINE_ Synopsis _NEWLINE_ Background : Owner of patents for pioneer drug to treat gastrointestinal disorders brought infringement action against applicants for approval to market generic versions . The United States District Court for the Southern District of New York , Barbara S. Jones , J. , 490 F.Supp.2d 381 , declaring patents enforceable , not invalid , and infringed . Applicants appealed . _NEWLINE_ _NEWLINE_ Holdings : The Court of Appeals , Bryson , Circuit Judge , held that : _NEWLINE_ _NEWLINE_ post-expiration remedy existed for infringement of patent on drug due to pediatric market exclusivity period ; _NEWLINE_ _NEWLINE_ patents did not require that omeprazole be stabilized without use of desiccant ; _NEWLINE_ _NEWLINE_ limitation , `` alkaline reacting compound , '' was met by showing that basic compound created `` micro-pH '' in drug core of not less than 7 ; _NEWLINE_ _NEWLINE_ enhanced stability of patented pharmaceutical preparation containing omeprazole was intended result of using inert subcoating around drug core containing amount of alkaline reacting compounds ( ARC ) in drug core sufficient to create micro-pH of not less than 7 ; _NEWLINE_ _NEWLINE_ accused formulation met `` inert subcoating '' limitation ; _NEWLINE_ _NEWLINE_ owner could prove infringement by showing presence of claimed structure without identifying process by which infringing subcoating had been produced ; _NEWLINE_ _NEWLINE_ formulation used had not been ready for patenting until after extensive clinical studies and real-time stability testing had been completed ; and _NEWLINE_ _NEWLINE_ person of ordinary skill would not have had any reason to apply subcoating to tablets shown in example in European patent application . _NEWLINE_ _NEWLINE_ Affirmed . _NEWLINE_ _NEWLINE_
0	_NEWLINE_ _NEWLINE_ _NEWLINE_ 805 F.3d 1092 _NEWLINE_ United States Court of Appeals , _NEWLINE_ Federal Circuit . _NEWLINE_ PROMETHEUS LABORATORIES , INC. , Plaintiff-Appellant _NEWLINE_ v. _NEWLINE_ ROXANE LABORATORIES , INC. , CIPLA , Ltd. , Defendants-Appellees . _NEWLINE_ Nos . 2014-1634 , 2014-1635 . _NEWLINE_ | _NEWLINE_ Nov. 10 , 2015 . _NEWLINE_ Synopsis _NEWLINE_ Background : Assignee commenced action against competitor , alleging infringement of patent claiming method of treatment for diarrhea-predominant irritable bowel syndrome utilizing alosetron . The United States District Court for the District of New Jersey , Faith S. Hochberg , J. , 2013 WL 6627640 , ruled that claims would have been obvious over the prior art or , in the alternative , invalid on grounds of obviousness-type double patenting . Assignee appealed . _NEWLINE_ _NEWLINE_ Holdings : The Court of Appeals , Dyk , Circuit Judge , held that : _NEWLINE_ _NEWLINE_ patent was obvious ; _NEWLINE_ _NEWLINE_ secondary considerations did not support conclusion that patent was not obvious ; and _NEWLINE_ _NEWLINE_ district court did not place burden of proof on assignee to demonstrate nexus between drug 's commercial success and patent , in analysis of whether patent was obvious . _NEWLINE_ _NEWLINE_ Affirmed . _NEWLINE_ _NEWLINE_
0	_NEWLINE_ _NEWLINE_ _NEWLINE_ 599 F.3d 1290 _NEWLINE_ United States Court of Appeals , _NEWLINE_ Federal Circuit . _NEWLINE_ Michael MARRIN and Etch-It , Inc. , Plaintiffs-Appellees , _NEWLINE_ v. _NEWLINE_ Jeffrey GRIFFIN and Claudia Griffin , Defendants-Appellants . _NEWLINE_ Jeffrey Griffin and Claudia Griffin , Plaintiffs-Appellants , _NEWLINE_ v. _NEWLINE_ Heidi Marrin , Michael Marrin , and Etch-It , Inc. , Defendants-Appellees . _NEWLINE_ No . 2009-1031 . _NEWLINE_ | _NEWLINE_ March 22 , 2010 . _NEWLINE_ | _NEWLINE_ Rehearing En Banc Denied May 14 , 2010 . * _NEWLINE_ Synopsis _NEWLINE_ Background : Patentees , as former licensors of scratch-off label device to mark beverage containers , filed state court infringement suit against former licensee . Following removal and consolidation with licensee 's suit seeking declaration that patent was invalid , the United States District Court for the Central District of California , George H. Wu , J. , 2008 WL 4184643 , granted licensee summary judgment of patent invalidity and non-infringement . Patentees appealed . _NEWLINE_ _NEWLINE_ Holdings : The Court of Appeals , Dyk , Circuit Judge , held that : _NEWLINE_ _NEWLINE_ preamble was not claim limitation distinguishing patent from prior art , and _NEWLINE_ _NEWLINE_ prior art references anticipated all claim limitations of patent . _NEWLINE_ _NEWLINE_ Affirmed . _NEWLINE_ _NEWLINE_ Newman , Circuit Judge , filed dissenting opinion . _NEWLINE_ _NEWLINE_
0	_NEWLINE_ _NEWLINE_ _NEWLINE_ 566 F.3d 1372 _NEWLINE_ United States Court of Appeals , _NEWLINE_ Federal Circuit . _NEWLINE_ TITAN TIRE CORPORATION and The Goodyear Tire & Rubber Company , Plaintiffs-Appellants , _NEWLINE_ v. _NEWLINE_ CASE NEW HOLLAND , INC. , CNH America LLC , and GPX International Tire Corporation , Defendants-Appellees . _NEWLINE_ No . 2008-1078 . _NEWLINE_ | _NEWLINE_ June 3 , 2009 . _NEWLINE_ Synopsis _NEWLINE_ Background : Owner and licensor filed action against competitor alleging infringement of design patent for tractor tire . The United States District Court for the Southern District of Iowa , James E. Gritzner , J. , 2007 WL 2914513 , denied plaintiffs ' motion for preliminary injunction . Plaintiffs appealed . _NEWLINE_ _NEWLINE_ The Court of Appeals , Plager , Circuit Judge , held that trial court did not abuse its discretion in concluding that licensor was unlikely to withstand competitor 's challenge to validity of patent on obviousness grounds . _NEWLINE_ _NEWLINE_ Affirmed . _NEWLINE_ _NEWLINE_
0	_NEWLINE_ _NEWLINE_ _NEWLINE_ 357 F.3d 1319 _NEWLINE_ United States Court of Appeals , _NEWLINE_ Federal Circuit . _NEWLINE_ NATIONAL STEEL CAR , LTD. , Plaintiff-Appellee , _NEWLINE_ v. _NEWLINE_ CANADIAN PACIFIC RAILWAY , LTD. , Canadian Pacific Railway Company , 3942503 Canada , Inc. , and Delaware & Hudson Railway Company , Inc. , Defendants-Appellants . _NEWLINE_ No . 03-1256 . _NEWLINE_ | _NEWLINE_ Jan. 29 , 2004 . _NEWLINE_ | _NEWLINE_ Rehearing and Rehearing En Banc Denied March 18 , 2004 . _NEWLINE_ Synopsis _NEWLINE_ Background : Rail car manufacturer sued railroad for patent infringement . The United States District Court for the Eastern District of Pennsylvania , 254 F.Supp.2d 527 , Mary A. McLaughlin , J. , granted preliminary injunction , and railroad appealed . _NEWLINE_ _NEWLINE_ Holdings : The Court of Appeals , Clevenger , Circuit Judge , held that : _NEWLINE_ _NEWLINE_ substantial question existed as to whether accused rail cars came within `` temporary presence '' exemption , and _NEWLINE_ _NEWLINE_ substantial question existed as to whether patent was invalid as obvious . _NEWLINE_ _NEWLINE_ Reversed . _NEWLINE_ _NEWLINE_
0	_NEWLINE_ _NEWLINE_ _NEWLINE_ 394 F.3d 1348 _NEWLINE_ United States Court of Appeals , _NEWLINE_ Federal Circuit . _NEWLINE_ BRUNO INDEPENDENT LIVING AIDS , INC. , Plaintiff-Appellant , _NEWLINE_ v. _NEWLINE_ ACORN MOBILITY SERVICES , LTD. , and Acorn Stairlifts , Inc. , Defendants-Cross Appellants . _NEWLINE_ Nos . 04-1114 , 04-1125 . _NEWLINE_ | _NEWLINE_ DECIDED : Jan. 11 , 2005 . _NEWLINE_ Synopsis _NEWLINE_ Background : Defendant who prevailed in patent infringement and false advertising suit moved for award of attorney fees . The United States District Court for the Western District of Wisconsin , Barbara B. Crabb , J. , 277 F.Supp.2d 965 , granted motion , and plaintiff appealed . _NEWLINE_ _NEWLINE_ The Court of Appeals , Lourie , Circuit Judge , held that plaintiff 's failure to disclose material prior art warranted finding that its subsequent infringement action was extraordinary . _NEWLINE_ _NEWLINE_ Affirmed . _NEWLINE_ _NEWLINE_
1	_NEWLINE_ _NEWLINE_ _NEWLINE_ 903 F.2d 789 _NEWLINE_ United States Court of Appeals , _NEWLINE_ Federal Circuit . _NEWLINE_ SHAMROCK TECHNOLOGIES , INC. , Plaintiff-Appellee , _NEWLINE_ v. _NEWLINE_ MEDICAL STERILIZATION , INC. , and Robert S. Luniewski , Defendants-Appellants . _NEWLINE_ No . 89-1711 . _NEWLINE_ | _NEWLINE_ May 4 , 1990 . _NEWLINE_ Synopsis _NEWLINE_ Holder of patent for apparatus and method for processing polytetrafluoroethylene with radiation brought action against former employee-inventor and former employee 's current employer alleging infringement . Inventor and current employer counterclaimed for declaration of invalidity . The United States District Court for the Eastern District of New York , Jacob Mishler , J. , applied doctrine of assignor estoppel and granted patent holder partial summary judgment . Appeal was taken . The Court of Appeals , Markey , Chief Judge , held that : ( 1 ) patent was infringed by radiation processing used by current employer , and ( 2 ) doctrine of assignor estoppel applied . _NEWLINE_ _NEWLINE_ Affirmed . _NEWLINE_ _NEWLINE_
1	_NEWLINE_ _NEWLINE_ _NEWLINE_ 867 F.3d 1253 _NEWLINE_ United States Court of Appeals , Federal Circuit . _NEWLINE_ VISUAL MEMORY LLC , Plaintiff-Appellant _NEWLINE_ v. _NEWLINE_ NVIDIA CORPORATION , Defendant-Appellee _NEWLINE_ 2016-2254 _NEWLINE_ | _NEWLINE_ Decided : August 15 , 2017 _NEWLINE_ Synopsis _NEWLINE_ Background : Holder of patent for computer memory system connectable to processor and having programmable operational characteristics based on characteristics of processor brought infringement action against competitor . The United States District Court for the District of Delaware , No . 1:15-cv-00789-RGA , Richard G. Andrews , J. , 2016 WL 3041847 , granted competitor 's motion to dismiss for failure to state a claim . Competitor appealed . _NEWLINE_ _NEWLINE_ The Court of Appeals , Stoll , Circuit Judge , held that claims were directed to patent-eligible subject matter of improved computer memory system , not to abstract idea of categorical data storage . _NEWLINE_ _NEWLINE_ Reversed and remanded . _NEWLINE_ _NEWLINE_ Hughes , Circuit Judge , filed dissenting opinion . _NEWLINE_ _NEWLINE_ *1254 Appeal from the United States District Court for the District of Delaware in No . 1:15-cv-00789-RGA , Judge Richard G. Andrews . _NEWLINE_
1	_NEWLINE_ _NEWLINE_ _NEWLINE_ 608 F.3d 1333 _NEWLINE_ United States Court of Appeals , _NEWLINE_ Federal Circuit . _NEWLINE_ TRIMED , INCORPORATED , Plaintiff-Appellant , _NEWLINE_ v. _NEWLINE_ STRYKER CORPORATION , Defendant-Appellee . _NEWLINE_ No . 2009-1423 . _NEWLINE_ | _NEWLINE_ June 9 , 2010 . _NEWLINE_ Synopsis _NEWLINE_ Background : Patentee brought infringement action against competitor , alleging infringement of patent relating to an implantable pin plate used to set bone fractures . The United States District Court for the Central District of California , Manuel L. Real , J. , granted competitor 's motion for summary judgment of noninfringement . Patentee appealed . The Court of Appeals , 514 F.3d 1256 , reversed and remanded . On remand , the United States District Court for the Central District of California , Manuel L. Real , J. , granted competitor 's motion for summary judgment of invalidity . Patentee again appealed . _NEWLINE_ _NEWLINE_ Holdings : The Court of Appeals , Linn , Circuit Judge , held that : _NEWLINE_ _NEWLINE_ fact issues as to whether patent was invalid as obvious precluded summary judgment ; _NEWLINE_ _NEWLINE_ district court failed to explain its invocation of commonsense in finding patent invalid on obviousness grounds ; _NEWLINE_ _NEWLINE_ district court was required to consider evidence regarding secondary considerations of nonobviousness before determining that patent was invalid as obvious ; _NEWLINE_ _NEWLINE_ fact issues as to whether patent was invalid on anticipation grounds precluded summary judgment ; and _NEWLINE_ _NEWLINE_ reassignment on remand was warranted to preserve appearance of justice . _NEWLINE_ _NEWLINE_ Reversed and remanded . _NEWLINE_ _NEWLINE_
1	_NEWLINE_ _NEWLINE_ _NEWLINE_ 807 F.2d 955 _NEWLINE_ United States Court of Appeals , _NEWLINE_ Federal Circuit . _NEWLINE_ CUSTOM ACCESSORIES , INC. , Plaintiff-Appellant , _NEWLINE_ v. _NEWLINE_ JEFFREY-ALLAN INDUSTRIES , INC. , Defendant-Appellee . _NEWLINE_ Appeal No . 85-2728 . _NEWLINE_ | _NEWLINE_ Dec. 12 , 1986 . _NEWLINE_ Synopsis _NEWLINE_ Patent holder brought infringement action . The United States District Court for the Northern District of Illinois , James B. Moran , J. , determined that claims of patent for mud flap and splash guard assemblies were obvious and invalid . Holder appealed . The Court of Appeals , Edward S. Smith , Circuit Judge , held that : ( 1 ) old or unpatentable nature of each element in claimed invention for mud flap or splash guard assemblies did not determine that invention was obvious and that patent was invalid ; ( 2 ) District Court was required to consider objective evidence of nonobviousness , which included evidence of copying and commercial success ; and ( 3 ) District Court failed to make sufficient , required findings with regard to scope and content of prior art , differences between prior art and claims at issue , level of ordinary skill in art , and objective evidence of nonobviousness . _NEWLINE_ _NEWLINE_ Vacated and remanded . _NEWLINE_ _NEWLINE_
0	_NEWLINE_ _NEWLINE_ _NEWLINE_ 363 F.3d 1247 _NEWLINE_ United States Court of Appeals , _NEWLINE_ Federal Circuit . _NEWLINE_ CHIRON CORPORATION , Plaintiff-Appellant , _NEWLINE_ v. _NEWLINE_ GENENTECH , INC. , Defendant-Cross Appellant . _NEWLINE_ Nos . 03-1158 , 03-1159 . _NEWLINE_ | _NEWLINE_ DECIDED : March 30 , 2004 . _NEWLINE_ | _NEWLINE_ Rehearing and Rehearing En Banc Denied June 8 , 2004 . _NEWLINE_ Synopsis _NEWLINE_ Background : Owner of patent for monoclonal antibodies capable of binding to specific human breast cancer antigen sued competitor for infringement . The United States District Court for the Eastern District of California , William B. Shubb , J. , entered judgment on jury verdict that patent was invalid as anticipated , and owner appealed . _NEWLINE_ _NEWLINE_ The Court of Appeals , Rader , Circuit Judge , held that patent , which could not claim priority dates of prior applications , was invalid as anticipated . _NEWLINE_ _NEWLINE_ Affirmed . _NEWLINE_ _NEWLINE_ Bryson , Circuit Judge , concurred and filed opinion . _NEWLINE_ _NEWLINE_ See also 268 F.Supp.2d 1148 . _NEWLINE_ _NEWLINE_
0	_NEWLINE_ _NEWLINE_ _NEWLINE_ 487 F.3d 897 _NEWLINE_ United States Court of Appeals , _NEWLINE_ Federal Circuit . _NEWLINE_ McKESSON INFORMATION SOLUTIONS , INC. , Plaintiff-Appellant , _NEWLINE_ v. _NEWLINE_ BRIDGE MEDICAL , INC. , Defendant-Appellee . _NEWLINE_ No . 2006-1517 . _NEWLINE_ | _NEWLINE_ May 18 , 2007 . _NEWLINE_ | _NEWLINE_ Rehearing En Banc Denied July 10 , 2007 . _NEWLINE_ Synopsis _NEWLINE_ Background : Patentee sued competitor for infringement of patent related to patient identification system . The United States District Court for the Eastern District of California , Frank C. Damrell , Jr. , J. , 2006 WL 1652518 , dismissed action , finding patent unenforceable due to inequitable conduct . Patentee appealed . _NEWLINE_ _NEWLINE_ Holdings : The Court of Appeals , Clevenger , Senior Circuit Judge , held that : _NEWLINE_ _NEWLINE_ prior art that applicant failed to disclose was not merely cumulative to prior art which was before examiner ; _NEWLINE_ _NEWLINE_ overwhelming circumstantial evidence , coupled with lack of any credible explanation for nondisclosure of prior art , supported finding that patentee had deceptive intent ; _NEWLINE_ _NEWLINE_ prior rejection of three-node communication claim would have been considered important by any reasonable examiner reviewing application ; _NEWLINE_ _NEWLINE_ patentee intended to deceive Patent and Trademark Office ( PTO ) by not disclosing to examiner adverse decisions by another examiner in a closely-related application ; _NEWLINE_ _NEWLINE_ allowance of claims to a three-node communication system was material to application and should have been disclosed to examiner ; and _NEWLINE_ _NEWLINE_ district court 's holding patent unenforceable was not abuse of discretion . _NEWLINE_ _NEWLINE_ Affirmed . _NEWLINE_ _NEWLINE_ Newman , Circuit Judge , filed a dissenting opinion . _NEWLINE_ _NEWLINE_
0	_NEWLINE_ _NEWLINE_ _NEWLINE_ 555 F.3d 984 _NEWLINE_ United States Court of Appeals , _NEWLINE_ Federal Circuit . _NEWLINE_ BALL AEROSOL AND SPECIALTY CONTAINER , INC. , Plaintiff-Appellee , _NEWLINE_ v. _NEWLINE_ LIMITED BRANDS , INC. , Bath & Body Works , Inc. , Henri Bendel , Inc. , and Bath & Body Works , Inc. ( doing business as The White Barn Candle Co. ) , Defendants-Appellants . _NEWLINE_ No . 2008-1333 . _NEWLINE_ | _NEWLINE_ Feb. 9 , 2009 . _NEWLINE_ Synopsis _NEWLINE_ Background : Assignee brought action against competitors alleging infringement of patent related to candle holder apparatus . The United States District Court for the Northern District of Illinois , Samuel Der-Yeghiayan , J. , construed disputed claims , 2006 WL 1049581 , concluded that competitors had infringed patent , 514 F.Supp.2d 1051 , and denied reconsideration , 553 F.Supp.2d 939 . Competitors appealed . _NEWLINE_ _NEWLINE_ Holdings : The Court of Appeals , Lourie , Circuit Judge , held that : _NEWLINE_ _NEWLINE_ phrase , `` to seat , '' did not require engagement between feet and cover ; _NEWLINE_ _NEWLINE_ combination of putting feet on bottom of candle holder and using cover as base for candle holder was predictable variation , and thus patent was obvious ; _NEWLINE_ _NEWLINE_ minimal indications of commercial success did not outweigh clear indication of obviousness apparent from prior art ; and _NEWLINE_ _NEWLINE_ patent had not been infringed by accused product that was reasonably capable of being put into claimed configuration . _NEWLINE_ _NEWLINE_ Reversed , vacated , and remanded . _NEWLINE_ _NEWLINE_
