0	_NEWLINE_ _NEWLINE_ _NEWLINE_ 698 F.3d 1374 _NEWLINE_ United States Court of Appeals , _NEWLINE_ Federal Circuit . _NEWLINE_ VOTER VERIFIED , INC. , Plaintiff-Appellant , _NEWLINE_ v. _NEWLINE_ PREMIER ELECTION SOLUTIONS , INC. , Defendant-Cross-Appellant , _NEWLINE_ and _NEWLINE_ Diebold Incorporated , Defendant-Appellee . _NEWLINE_ Voter Verified , Inc. , Plaintiff-Appellant , _NEWLINE_ v. _NEWLINE_ Election Systems & Software , Inc. , Defendant-Cross-Appellant . _NEWLINE_ Nos . 2011-1553 , 2012-1017 , 2011-1559 , 2012-1016 . _NEWLINE_ | _NEWLINE_ Nov. 5 , 2012 . _NEWLINE_ | _NEWLINE_ Rehearing and Rehearing En Banc Denied Jan. 10 , 2013 . _NEWLINE_ Synopsis _NEWLINE_ Background : In two related cases , holder of patents for automated systems and methods for voting in elections brought actions against competitors , alleging infringement . The United States District Court for the Middle District of Florida , No . 09-CV-1968 , Patricia C. Fawsett , Senior District Judge , 739 F.Supp.2d 1340 , construed patent and ruled it not infringed , 745 F.Supp.2d 1237 , ruled patent invalid in part , 2011 WL 233804 , ruled patent invalid in part and , 2011 WL 3841580 , denied patent holder 's motion for reconsideration , 2011 WL 250426 , ruled patent invalid in part , 2011 WL 3236023 , ruled patent not infringed in part , 2011 WL 148879 and 2011 WL 108396 , denied patent holder 's motion to suspend case management and scheduling order , and , 2011 WL 3269595 , denied patent holder 's motion for summary judgment and , 2011 WL 3862450 , denied reconsideration of that order . Patent holder appealed , and appeals were consolidated . _NEWLINE_ _NEWLINE_ Holdings : The Court of Appeals , Lourie , Circuit Judge , held that : _NEWLINE_ _NEWLINE_ article obtained from online periodical qualified as prior art printed publication ; _NEWLINE_ _NEWLINE_ article rendered patent claim obvious ; _NEWLINE_ _NEWLINE_ patent claims describing self-verifying voting system were not infringed ; and _NEWLINE_ _NEWLINE_ competitors did not exercise requisite control over voters to support direct infringement claim . _NEWLINE_ _NEWLINE_ Affirmed . _NEWLINE_ _NEWLINE_
0	_NEWLINE_ _NEWLINE_ _NEWLINE_ 455 F.3d 1351 _NEWLINE_ United States Court of Appeals , _NEWLINE_ Federal Circuit . _NEWLINE_ FLEX-REST , LLC , Plaintiff-Appellant , _NEWLINE_ v. _NEWLINE_ STEELCASE , INC. , Defendant-Cross Appellant . _NEWLINE_ Nos . 05-1354 , 05-1367 . _NEWLINE_ | _NEWLINE_ July 13 , 2006 . _NEWLINE_ Synopsis _NEWLINE_ Background : Patentee brought action against competitor , alleging infringement of patents for a computer keyboard positioning system that positioned the keyboard in a negative tilt position . Following remand , 112 Fed.Appx . 28 , the United States District Court for the Western District of Michigan , David W. McKeague , J. , entered judgment finding that one patent was invalid for anticipation and obviousness and another patent was not infringed . Patentee appealed . _NEWLINE_ _NEWLINE_ Holdings : The Court of Appeals , Linn , Circuit Judge , held that : _NEWLINE_ _NEWLINE_ competitor did not intentionally suppress or conceal alleged prior art device ; _NEWLINE_ _NEWLINE_ patent 's `` sidewall '' limitation meant a structure projecting or extending upward , above the plane of the support surface , from either side of the support tray ; and _NEWLINE_ _NEWLINE_ patent counsel 's failure to disclose to the Patent and Trademark Office ( PTO ) a letter from a competitor which included photographs of a keyboard support system when applying for patent was not inequitable conduct . _NEWLINE_ _NEWLINE_ Affirmed . _NEWLINE_ _NEWLINE_
0	_NEWLINE_ _NEWLINE_ _NEWLINE_ 626 F.3d 1361 _NEWLINE_ United States Court of Appeals , _NEWLINE_ Federal Circuit . _NEWLINE_ The WESTERN UNION COMPANY , Plaintiff-Appellee , _NEWLINE_ v. _NEWLINE_ MONEYGRAM PAYMENT SYSTEMS , INC. , Defendant-Appellant . _NEWLINE_ Nos . 2010-1080 , 2010-1210 . _NEWLINE_ | _NEWLINE_ Dec. 7 , 2010 . _NEWLINE_ | _NEWLINE_ Rehearing and Rehearing En Banc Denied Feb. 8 , 2011 . * _NEWLINE_ Synopsis _NEWLINE_ Background : Money transfer service company filed action against competitor alleging infringement of its patents directed to system for performing money transfers . The United States District Court for the Western District of Texas , Sam Sparks , J. , entered judgment on jury verdict in patentee 's favor , and denied competitor 's motion for judgment as matter of law . Competitor appealed . _NEWLINE_ _NEWLINE_ Holdings : The Court of Appeals , Lourie , Circuit Judge , held that : _NEWLINE_ _NEWLINE_ competitor did not waive obviousness claim ; _NEWLINE_ _NEWLINE_ patent claims were obvious ; and _NEWLINE_ _NEWLINE_ evidence of secondary considerations was irrelevant . _NEWLINE_ _NEWLINE_ Reversed . _NEWLINE_ _NEWLINE_
0	_NEWLINE_ _NEWLINE_ _NEWLINE_ 527 F.3d 1318 _NEWLINE_ United States Court of Appeals , _NEWLINE_ Federal Circuit . _NEWLINE_ GOLDEN BRIDGE TECHNOLOGY , INC. , Plaintiff-Appellant , _NEWLINE_ v. _NEWLINE_ NOKIA , INC. , Defendant , _NEWLINE_ and _NEWLINE_ Lucent Technologies , Inc. , Defendant-Appellee . _NEWLINE_ No . 2007-1215 . _NEWLINE_ | _NEWLINE_ May 21 , 2008 . _NEWLINE_ Synopsis _NEWLINE_ Background : Assignee brought action against competitor alleging infringement of patent that claimed technique to achieve gradual ramping up of power signal in code division multiple access ( CDMA ) mobile communication system . The United States District Court for the Eastern District of Texas , Leonard Davis , J. , 2007 WL 294176 , granted summary judgment that patent was invalid as anticipated . Assignee appealed . _NEWLINE_ _NEWLINE_ Holdings : The Court of Appeals , Moore , Circuit Judge , held that : _NEWLINE_ _NEWLINE_ fact issue of whether prior art reference disclosed `` synchronization prior to transmission '' limitation in patent could not be raised by assignee for first time on appeal ; _NEWLINE_ _NEWLINE_ assignee did not raise issue before district court of whether prior art reference disclosed `` synchronization prior to transmission '' limitation in patent ; _NEWLINE_ _NEWLINE_ client 's selection of new counsel for making appeal did not present exceptional case or circumstance in which declining appellate review of arguments not presented to district court would result in injustice ; _NEWLINE_ _NEWLINE_ Court of Appeals could not determine in first instance on appeal what particular prior art reference disclosed ; and _NEWLINE_ _NEWLINE_ assignee 's argument raised for first time on appeal without any justification , as to what prior art reference disclosed , did not warrant remand to district court . _NEWLINE_ _NEWLINE_ Affirmed . _NEWLINE_ _NEWLINE_
1	_NEWLINE_ _NEWLINE_ _NEWLINE_ 266 F.3d 1358 _NEWLINE_ United States Court of Appeals , _NEWLINE_ Federal Circuit . _NEWLINE_ LORAL FAIRCHILD CORPORATION , Plaintiff-Appellant , _NEWLINE_ v. _NEWLINE_ MATSUSHITA ELECTRICAL INDUSTRIAL COMPANY , LTD. , Matsushita Electric Corporation of America , Canon U.S.A. , Inc. , Canon , Inc. , Fairchild Semiconductor Corporation , Fuji Photo Film Co. , Ltd. , Fuji Photo Film U.S.A. , Inc. , Gold Star Electronic International , Goldstar Co. , Ltd. , Hitachi Home Electronics ( America ) , Inc. , Hitachi , Ltd. , Kokos Color TV , Inc. , Mitsubishi Electric Corp. , Mitsubishi Electric Sales America , Inc. , National Semiconductor Corporation , Nippon Electric Company , Ltd. , and Samsung Electronics America , Inc. , Defendants , _NEWLINE_ and _NEWLINE_ Toshiba Corporation , Toshiba America , Inc. , Toshiba America Consumer Products , Inc. , Toshiba America Electronic Components , Inc. , and Toshiba America Information Systems , Inc. , Defendants-Appellees , _NEWLINE_ and _NEWLINE_ NEC Corporation , NEC America , Inc. , and NEC Technologies , Inc. , Defendants-Appellees . _NEWLINE_ No . 00-1487 . _NEWLINE_ | _NEWLINE_ Sept. 21 , 2001 . _NEWLINE_ | _NEWLINE_ Rehearing Denied Oct. 17 , 2001 . _NEWLINE_ Synopsis _NEWLINE_ Patentee brought action against alleged infringers relating to patent on process for manufacturing a charge coupled device . The United States District Court for the Eastern District of New York , Randall R. Rader , J. , sitting by designation , granted judgment of invalidity based on obviousness . Patentee appealed . The Court of Appeals , Michel , Circuit Judge , held that : ( 1 ) fact issue existed precluding summary judgment , and ( 2 ) patent holder presented corroborating evidence that it began production efforts using claimed process . _NEWLINE_ _NEWLINE_ Reversed and remanded . _NEWLINE_ _NEWLINE_ Pauline Newman , Circuit Judge , filed an opinion concurring in the judgment . _NEWLINE_ _NEWLINE_
1	_NEWLINE_ _NEWLINE_ _NEWLINE_ 374 F.3d 1151 _NEWLINE_ United States Court of Appeals , _NEWLINE_ Federal Circuit . _NEWLINE_ TYPERIGHT KEYBOARD CORPORATION , Plaintiff-Appellant , _NEWLINE_ v. _NEWLINE_ MICROSOFT CORPORATION , Defendant-Cross Appellant . _NEWLINE_ Nos . 03-1197 , 03-1255 . _NEWLINE_ | _NEWLINE_ Decided : July 6 , 2004 . _NEWLINE_ Synopsis _NEWLINE_ Background : Owner of patents on ergonomic computer keyboards brought infringement action against competitor . The United States District Court for the Southern District of California , Irma E. Gonzalez , J. , granted summary judgment of invalidity to competitor , but dismissed competitor 's counterclaims for inequitable conduct and non-infringement . Owner appealed , and competitor cross-appealed . _NEWLINE_ _NEWLINE_ Holdings : The Court of Appeals , Dyk , Circuit Judge , held that : _NEWLINE_ _NEWLINE_ Court of Appeals lacked jurisdiction over competitor 's cross-appeal , and _NEWLINE_ _NEWLINE_ genuine issue of material fact as to whether alleged prior art reference was publicly distributed prior to patent 's critical date precluded summary judgment of patent invalidity . _NEWLINE_ _NEWLINE_ Reversed and remanded . _NEWLINE_ _NEWLINE_
0	_NEWLINE_ _NEWLINE_ _NEWLINE_ 480 F.3d 1129 _NEWLINE_ United States Court of Appeals , _NEWLINE_ Federal Circuit . _NEWLINE_ eSPEED , INC. , Cantor Fitzgerald , L.P. , CFPH , L.L.C. , and eSpeed Government Securities , Inc. , Plaintiffs-Appellants , _NEWLINE_ v. _NEWLINE_ BROKERTEC USA , L.L.C. , Garban , L.L.C. , OM Technology US , Inc. , and OM Technology AB , Defendants-Appellees . _NEWLINE_ No . 2006-1385 . _NEWLINE_ | _NEWLINE_ March 20 , 2007 . _NEWLINE_ | _NEWLINE_ Rehearing and Rehearing En Banc Denied May 23 , 2007 . _NEWLINE_ Synopsis _NEWLINE_ Background : Owner of patent for electronic trading platform used in trading government securities sued competitor for infringement . Competitor counterclaimed that patent was unenforceable , and that suit was barred by laches . The United States District Court for the District of Delaware , Kent A. Jordan , J. , 417 F.Supp.2d 580 , found patent was unenforceable because of inequitable conduct , and entered final judgment in favor of competitor . Patent owner appealed . _NEWLINE_ _NEWLINE_ Holdings : The Court of Appeals , Moore , Circuit Judge , held that : _NEWLINE_ _NEWLINE_ false statements in declarations submitted during prosecution , to disclose prior art and attempt to cure the earlier non-disclosure of this prior art , were material , and _NEWLINE_ _NEWLINE_ finding that declarations were submitted with intent to deceive the Patent and Trademark Office ( PTO ) was not clearly erroneous . _NEWLINE_ _NEWLINE_ Affirmed . _NEWLINE_ _NEWLINE_
1	_NEWLINE_ _NEWLINE_ _NEWLINE_ 783 F.3d 853 _NEWLINE_ United States Court of Appeals , _NEWLINE_ Federal Circuit . _NEWLINE_ INSITE VISION INCORPORATED , Inspire Pharmaceuticals , Inc. , Pfizer Inc. , Plaintiffs-Appellees _NEWLINE_ v. _NEWLINE_ SANDOZ , INC. , Defendant-Appellant _NEWLINE_ Sandoz GmbH , Sandoz Industrial Products S.A. , Defendants . _NEWLINE_ No . 2014-1065 . _NEWLINE_ | _NEWLINE_ April 9 , 2015 . _NEWLINE_ Synopsis _NEWLINE_ Background : Patentee brought action against a competitor , claiming that the competitor 's filing of an abbreviated new drug application ( ANDA ) for a generic drug to treat eye infections infringed on four patents that disclosed methods of treating eye infections by the topical administration of azithromycin , an antibiotic , to the eye . Following a bench trial , the United States District Court for the District of New Jersey , Mary L. Cooper , J. , 2013 WL 5975015 , upheld the validity of all of the patents-in-suit . The competitor appealed . _NEWLINE_ _NEWLINE_ Holdings : The Court of Appeals , Linn , Circuit Judge , held that : _NEWLINE_ _NEWLINE_ the competitor failed to demonstrate that treating conjunctivitis with a topical application of azithromycin would have been obvious to persons of ordinary skill in the art ; _NEWLINE_ _NEWLINE_ the competitor failed to demonstrate that using topical azithromycin in a gel eyedrop for treating eye infections was obvious to persons of ordinary skill in the art ; and _NEWLINE_ _NEWLINE_ the District Court did not abuse its excluding evidence of European patent proceedings . _NEWLINE_ _NEWLINE_ Affirmed . _NEWLINE_ _NEWLINE_
0	_NEWLINE_ _NEWLINE_ _NEWLINE_ 140 F.3d 1009 _NEWLINE_ United States Court of Appeals , _NEWLINE_ Federal Circuit . _NEWLINE_ DAWN EQUIPMENT COMPANY , Plaintiff-Appellee , _NEWLINE_ v. _NEWLINE_ KENTUCKY FARMS INCORPORATED , Defendant-Appellant . _NEWLINE_ No . 97-1042 . _NEWLINE_ | _NEWLINE_ March 24 , 1998 . _NEWLINE_ Synopsis _NEWLINE_ Patentee brought action alleging infringement of patent on device for adjusting height of farm implements . The United States District Court for the Northern District of Illinois , Philip G. Reinhard , J. , entered judgment upon jury verdict for patentee , finding infringement under doctrine of equivalents , and denied defendant 's motion for judgment as matter of law . Defendant appealed . The Court of Appeals , Plager , Circuit Judge , held that accused device , which had multiple-hole , pinned height-adjustment mechanism , did not infringe , under doctrine of equivalents , patent 's locking and releasing means with structure that included rotatable shaft , pin , and slot . _NEWLINE_ _NEWLINE_ Reversed . _NEWLINE_ _NEWLINE_ Plager , Circuit Judge , filed additional views . _NEWLINE_ _NEWLINE_ Pauline Newman , Circuit Judge , filed additional views . _NEWLINE_ _NEWLINE_ Michel , Circuit Judge , filed additional views . _NEWLINE_ _NEWLINE_
1	_NEWLINE_ _NEWLINE_ _NEWLINE_ 952 F.2d 1357 _NEWLINE_ United States Court of Appeals , _NEWLINE_ Federal Circuit . _NEWLINE_ The LAITRAM CORPORATION , Plaintiff-Appellant , _NEWLINE_ v. _NEWLINE_ NEC CORPORATION , NEC Information Systems , Inc. , and Sears , Roebuck and Company , Defendants-Appellees . _NEWLINE_ No . 91-1108 . _NEWLINE_ | _NEWLINE_ Dec. 31 , 1991 . _NEWLINE_ | _NEWLINE_ Suggestion for Rehearing In Banc Declined Jan. 30 , 1992 . _NEWLINE_ Synopsis _NEWLINE_ In patent infringement action , the United States District Court for the Eastern District of Louisiana , A.J . McNamara , J. , granted partial summary judgment in favor of defendant , and order was certified for immediate appeal . The Court of Appeals , Pauline Newman , Circuit Judge , held that : ( 1 ) amendments made to patent claims during reexamination are not per se substantive when the amendments are made following rejection based on prior art , and ( 2 ) material factual premises underlying interpretation of amendments made to patent claims during reexamination following rejection based on prior art were in genuine dispute , precluding summary judgment . _NEWLINE_ _NEWLINE_ Reversed and remanded . _NEWLINE_ _NEWLINE_
1	_NEWLINE_ _NEWLINE_ _NEWLINE_ 583 F.3d 766 _NEWLINE_ United States Court of Appeals , _NEWLINE_ Federal Circuit . _NEWLINE_ ASTRAZENECA PHARMACEUTICALS LP and Astrazeneca UK Limited , Plaintiffs-Appellees , _NEWLINE_ v. _NEWLINE_ TEVA PHARMACEUTICALS USA , INC. and Teva Pharmaceutical Industries , Ltd. , Defendants-Appellants , _NEWLINE_ and _NEWLINE_ Sandoz , Inc. , Defendant-Appellant . _NEWLINE_ Nos . 2008-1480 , 2008-1481 . _NEWLINE_ | _NEWLINE_ Sept. 25 , 2009 . _NEWLINE_ Synopsis _NEWLINE_ Background : Patent owner brought action against competitor alleging infringement of patent covering antipsychotic drug quetiapine . The United States District Court for the District of New Jersey , Joel A. Pisano , J. , 567 F.Supp.2d 683 , granted owner 's motion for summary judgment of no inequitable conduct in prosecution of patent application , and competitor appealed . _NEWLINE_ _NEWLINE_ Holdings : The Court of Appeals , Newman , Circuit Judge , held that : _NEWLINE_ _NEWLINE_ owner 's provision of its existing test data for certain prior art compound was not material misrepresentation or omission ; _NEWLINE_ _NEWLINE_ owner did not make implied misrepresentation that no prior art compound was atypical ; and _NEWLINE_ _NEWLINE_ withholding of information regarding certain atypical compounds did not , without more , demonstrate intent to deceive . _NEWLINE_ _NEWLINE_ Affirmed . _NEWLINE_ _NEWLINE_
1	_NEWLINE_ _NEWLINE_ _NEWLINE_ 492 F.3d 1350 _NEWLINE_ United States Court of Appeals , _NEWLINE_ Federal Circuit . _NEWLINE_ TAKEDA CHEMICAL INDUSTRIES , LTD. and Takeda Pharmaceuticals North America , INC. , Plaintiffs-Appellees , _NEWLINE_ v. _NEWLINE_ ALPHAPHARM PTY. , LTD. and Genpharm , Inc. , Defendants-Appellants . _NEWLINE_ No . 06-1329 . _NEWLINE_ | _NEWLINE_ June 28 , 2007 . _NEWLINE_ Synopsis _NEWLINE_ Background : Owner of patent for diabetes drug brought infringement actions against proposed manufacturers of generic versions . The United States District Court for the Southern District of New York , Denise Cote , J. , 417 F.Supp.2d 341 , granted judgment for owner . Manufacturers appealed . _NEWLINE_ _NEWLINE_ Holdings : The Court of Appeals , Lourie , Circuit Judge , held that : _NEWLINE_ _NEWLINE_ person of ordinary skill in the art would not have selected closest prior art compound as lead compound for antidiabetic treatment ; _NEWLINE_ _NEWLINE_ person of ordinary skill in the art would not have been prompted to modify closest prior art compound , using steps of homologation or ring-walking , to synthesize claimed compound ; and _NEWLINE_ _NEWLINE_ any error was harmless that district court may have committed by incorrectly implying that prosecution histories were not accessible to public . _NEWLINE_ _NEWLINE_ Affirmed . _NEWLINE_ _NEWLINE_ Dyk , Circuit Judge , filed concurring opinion . _NEWLINE_ _NEWLINE_
0	_NEWLINE_ _NEWLINE_ _NEWLINE_ 190 F.3d 1335 _NEWLINE_ United States Court of Appeals , _NEWLINE_ Federal Circuit . _NEWLINE_ MERCK & CO. , INC. , Plaintiff-Appellant , _NEWLINE_ v. _NEWLINE_ MYLAN PHARMACEUTICALS , INC. , Defendant-Appellee . _NEWLINE_ No . 99-1044 . _NEWLINE_ | _NEWLINE_ Sept. 3 , 1999 . _NEWLINE_ Synopsis _NEWLINE_ Patentee brought action against competitor for infringement of two patents directed to controlled release formulation of drug combination used to treat Parkinson 's disease . The United States District Court for the Eastern District of Pennsylvania , Eduardo C. Robreno , J. , 19 F.Supp.2d 334 , granted summary judgment of noninfringement , and patentee appealed . The Court of Appeals , Pauline Newman , Circuit Judge , held that : ( 1 ) fact that patentee was required by examiner to elect a species from proposed genus of polymers listed in patent application did not establish that resulting amendment was not made to overcome patentability rejection , and ( 2 ) infringement claim was barred by prosecution history estoppel . _NEWLINE_ _NEWLINE_ Affirmed . _NEWLINE_ _NEWLINE_
0	_NEWLINE_ _NEWLINE_ _NEWLINE_ 485 F.3d 1157 _NEWLINE_ United States Court of Appeals , _NEWLINE_ Federal Circuit . _NEWLINE_ LEAPFROG ENTERPRISES , INC. , Plaintiff-Appellant , _NEWLINE_ v. _NEWLINE_ FISHER-PRICE , INC. and Mattel , Inc. , Defendants-Appellees . _NEWLINE_ No . 06-1402 . _NEWLINE_ | _NEWLINE_ May 9 , 2007 . _NEWLINE_ Synopsis _NEWLINE_ Background : Patent holder brought action against competitor alleging infringement of patent directed toward interactive learning device . The United States District Court for the District of Delaware , Gregory M. Sleet , J. , 2006 WL 891001 , entered judgment of noninfringement and invalidity . Patent holder appealed . _NEWLINE_ _NEWLINE_ Holdings : The Court of Appeals , Lourie , Circuit Judge , held that : _NEWLINE_ _NEWLINE_ accused device could not practice `` selection of a depicted letter '' ; _NEWLINE_ _NEWLINE_ claim was invalid as obvious ; and _NEWLINE_ _NEWLINE_ substantial evidence of commercial success , praise , and long-felt need was inadequate to overcome final conclusion that claim in patent would have been obvious given strength of prima facie obviousness showing . _NEWLINE_ _NEWLINE_ Affirmed . _NEWLINE_ _NEWLINE_
0	_NEWLINE_ _NEWLINE_ _NEWLINE_ 265 F.3d 1349 _NEWLINE_ United States Court of Appeals , _NEWLINE_ Federal Circuit . _NEWLINE_ Roger W. BROWN , Ph.D. , Plaintiff-Appellant , _NEWLINE_ v. _NEWLINE_ 3M , Defendant-Appellee , _NEWLINE_ and _NEWLINE_ Air Products and Chemicals , Inc. , Defendant-Appellee , _NEWLINE_ and _NEWLINE_ Revlon , Inc. , Defendant . _NEWLINE_ No . 00-1552 . _NEWLINE_ | _NEWLINE_ Sept. 18 , 2001 . _NEWLINE_ Synopsis _NEWLINE_ Patentee brought suit alleging infringement of its patent for computer data processing system directed at solving Year 2000 ( Y2K ) problem by setting computer clock to an offset time . The United States District Court for the District of Arizona , Paul G. Rosenblatt , J. , granted summary judgment of invalidity to competitor . Patentee appealed . The Court of Appeals , Pauline Newman , Circuit Judge , held that : ( 1 ) patent described an apparatus capable of converting only two-digit , only three-digit , only four-digit , or any combination of two- , three- , and four-digit date-data , and ( 2 ) patent thus was anticipated by prior art , and was invalid for lack of novelty . _NEWLINE_ _NEWLINE_ Affirmed . _NEWLINE_ _NEWLINE_ Mayer , Chief Judge , dissented and filed opinion . _NEWLINE_ _NEWLINE_
0	_NEWLINE_ _NEWLINE_ _NEWLINE_ 103 F.3d 1554 _NEWLINE_ United States Court of Appeals , _NEWLINE_ Federal Circuit . _NEWLINE_ UNITED STATES SURGICAL CORPORATION , Plaintiff-Appellant , _NEWLINE_ v. _NEWLINE_ ETHICON , INC. and Johnson & Johnson Hospital Services , Inc. , Defendants/Cross-Appellants . _NEWLINE_ Nos . 94-1386 , 94-1419 . _NEWLINE_ | _NEWLINE_ Jan. 3 , 1997 . _NEWLINE_ | _NEWLINE_ Rehearing Denied ; Suggestion for Rehearing In Banc Declined May 30 , 1997 . _NEWLINE_ Synopsis _NEWLINE_ Holder of patents for surgical instrument for ligating blood vessels and other tissues during endoscopic surgery sued alleged infringers . The United States District Court for the District of Connecticut entered judgment on jury verdict that patents were invalid for obviousness . Patentee appealed . The Court of Appeals affirmed . Patentee sought writ of certiorari . The Supreme Court vacated . On remand , the Court of Appeals , Pauline Newman , Circuit Judge , held that evidence supported jury 's verdict that patents were obvious . _NEWLINE_ _NEWLINE_ Affirmed . _NEWLINE_ _NEWLINE_
0	_NEWLINE_ _NEWLINE_ _NEWLINE_ 522 F.3d 1299 _NEWLINE_ United States Court of Appeals , _NEWLINE_ Federal Circuit . _NEWLINE_ POWEROASIS , INC. and PowerOasis Networks , LLC , Plaintiffs-Appellants , _NEWLINE_ v. _NEWLINE_ T-MOBILE USA , INC. , Defendant-Appellee . _NEWLINE_ No . 2007-1265 . _NEWLINE_ | _NEWLINE_ April 11 , 2008 . _NEWLINE_ | _NEWLINE_ Rehearing and Rehearing En Banc Denied Aug. 13 , 2008 . _NEWLINE_ Synopsis _NEWLINE_ Background : Patent owner brought action against competitor alleging infringement of patents directed toward vending machines that sold telecommunications access . The United States District Court for the District of New Hampshire , Paul Barbadoro , J. , 2007 WL 962937 , granted competitor 's motion for summary judgment of invalidity . Owner appealed . _NEWLINE_ _NEWLINE_ Holdings : The Court of Appeals , Moore , Circuit Judge , held that : _NEWLINE_ _NEWLINE_ owner had burden to come forward with evidence to prove entitlement to claim priority to earlier filing date ; _NEWLINE_ _NEWLINE_ asserted claims in continuation-in-part ( CIP ) application that added language describing vending machine with user interface located remotely from vending machine , such as on user 's laptop , were not entitled to effective filing date of original application that claimed user interface that was part of unitary vending machine ; _NEWLINE_ _NEWLINE_ expert did not demonstrate at time of filing date of original application how applicant was in possession of claimed invention either expressly or inherently ; and _NEWLINE_ _NEWLINE_ owner was not entitled to broad claim construction for purposes of infringement and different narrower claim construction for purposes of validity . _NEWLINE_ _NEWLINE_ Affirmed . _NEWLINE_ _NEWLINE_
